{
  "$schema": "./config.schema.json",
  "schema_version": 2,
  "site": {
    "base_url": "https://username.github.io",
    "language": "en",
    "seo": {
      "title": "Your Name — Developer Portfolio",
      "description": "Selected work, experience, and open-source projects by Your Name.",
      "keywords": ["developer", "portfolio", "open source"],
      "og_image": "https://avatars.githubusercontent.com/username?s=1200",
      "og_image_alt": "Portrait of Your Name"
    }
  },
  "person": {
    "name": "Your Name",
    "professional_headline": "Developer and technical community builder",
    "current_role": "Your current role",
    "organization": "Your organization",
    "location": "Your location",
    "avatar": "https://avatars.githubusercontent.com/username?s=512",
    "github_username": "username",
    "focus_areas": ["Product engineering", "Developer education", "Open source"],
    "languages": ["English"]
  },
  "hero": {
    "heading": "I build useful products and help developer communities thrive.",
    "summary": "A short, specific statement about what you do, who you help, and the outcomes you create.",
    "primary_cta": {"label": "View selected work", "url": "#impact"},
    "secondary_cta": {"label": "Connect on LinkedIn", "url": "https://www.linkedin.com/in/username/"}
  },
  "impact_metrics": [
    {"value": "10+", "label": "Projects shipped"},
    {"value": "5+", "label": "Years of experience"},
    {"value": "3", "label": "Focus areas"},
    {"value": "1", "label": "Clear point of view"}
  ],
  "navigation": [
    {"label": "Impact", "target": "impact"},
    {"label": "Experience", "target": "experience"},
    {"label": "Work", "target": "work"},
    {"label": "Contact", "target": "contact"}
  ],
  "projects": {
    "title": "Selected impact",
    "items": [
      {
        "id": "portfolio-v2",
        "name": "Portfolio v2",
        "date": "2026",
        "role": "Designer and developer",
        "summary": "A static portfolio designed around clear positioning, evidence, and accessibility.",
        "challenge": "Turn a long résumé into a focused, easy-to-scan story.",
        "actions": ["Designed a schema-driven content system", "Generated meaningful HTML at build time"],
        "outcomes": ["Fast static delivery", "Accessible navigation and disclosures"],
        "featured": true,
        "media": {"src": "assets/projects/Placeholder.png", "alt": "Portfolio project preview", "fit": "contain"},
        "links": [{"label": "View project", "url": "https://github.com/username/username.github.io"}]
      }
    ]
  },
  "experience": {
    "title": "Experience",
    "visible_count": 1,
    "jobs": [
      {
        "company": "Your organization",
        "role": "Your current role",
        "date": "2024 — Present",
        "responsibilities": ["Describe the problem you own", "Add one measurable result"],
        "logo": "assets/logos/Placeholder_Logo.png",
        "logo_dark": "assets/logos/Placeholder_Logo.png"
      }
    ]
  },
  "proof": {
    "title": "Capabilities & credentials",
    "items": ["Product engineering", "Developer education", "Community systems", "Technical writing"]
  },
  "open_source": {
    "title": "Tools and open-source work",
    "items": [
      {
        "name": "Developer portfolio",
        "summary": "The repository behind this configurable static portfolio.",
        "url": "https://github.com/username/username.github.io"
      }
    ]
  },
  "contact": {
    "heading": "Let’s build something useful.",
    "summary": "Available for collaborations, speaking, and thoughtful product conversations.",
    "primary_cta": {"label": "Connect on LinkedIn", "url": "https://www.linkedin.com/in/username/"},
    "social_links": [
      {"name": "GitHub", "url": "https://github.com/username"},
      {"name": "LinkedIn", "url": "https://www.linkedin.com/in/username/"}
    ]
  },
  "footer": {
    "copyright": "Your Name",
    "show_built_with": true,
    "built_with_text": "Built with the Developer Portfolio v2 engine."
  }
}
